"Username","bio","faculty","student","mza","other.sci","outreach","sci.assoc","media","applied","politician","unknown","public"
"@allenzomberg","biologist in training interested in all organisms their fossilized ancestors fictional representations artificial or alien equivalents",0,0,0,1,0,0,0,0,0,0,0
"@bach_mira","medical bioinformatician author of the mira assembler",0,0,0,1,0,0,1,0,0,0,0
"@geogsouthampton","welcome to geography environment at the university of southampton join us together we can help shape the future of our world",0,0,0,1,0,0,0,0,0,0,0
"@brewkeeper","amphibian advocate beer buff conservation crazy divemaster",0,0,0,0,0,0,0,0,0,0,1
"@citizenecology","citizen science project involving the public in studying forest ecology impacts of climate change tweets from alison smith",0,1,0,0,0,0,0,0,0,0,0
"@climategordon","palaeoclimate phd student working with eocene biomarkers in the organic geochemistry unit bristol geologist scottish",0,1,0,0,0,0,0,0,0,0,0
"@aishaliebenow","communication strategy design interested in the environment urban ag food health uwmadison graduate",0,0,0,0,0,0,1,0,0,0,0
"@gem_hough","research entomologist fan of nature music film books fancy dress",0,0,0,1,0,0,1,0,0,0,0
"@katebrownisland","perspectives views on islands specifically conservation sustainable livelihoods sometimes island people eg my kids from nz",0,0,0,0,0,0,0,0,0,0,1
"@aprilpawluk","grad student at university of toronto aspiring science journal editor bacteria phage fanatic nerd",0,1,0,0,0,0,0,0,0,0,0
"@fivemetrestop","scubablog diveclothing scubashirts ebayscuba divetwitterage divedivedive",0,0,0,0,0,0,1,0,0,0,0
"@gradymccallie","policy director nc conservation network water environment public policy growth planning nonwork tweets bezoar44",0,0,0,0,0,1,0,0,0,0,0
"@buzzcolour","i tweet about brilliant colours small acts of kindness",0,0,0,0,0,0,0,0,0,0,1
"@ibietpost","chemist hiker blogger nonpermanent scientist permanently involved in any kind of already lost battle novice in all arts master in nothing",0,0,0,1,0,0,1,0,0,0,0
"@gaiavs","not in a specific order immunologist career development emorypostdocs mom founder city mouse whats scizzling hot in your science myscizzle",0,0,0,1,0,0,0,0,0,0,0
"@965traffic","giving you triple team coverage of traffic every 6 minutes in the morning on orlandos morning news updates throughout the day",0,0,0,0,0,0,1,0,0,0,0
"@dragonheart40","business analyst gardener magick lover 0",0,0,0,0,0,0,0,0,0,0,1
"@aihardin","a tangled bank of biology computers star wars",0,0,0,1,0,0,0,0,0,0,0
"@durrell_academy","a world leader in conservation capacity development operating at the interface between insitu exsitu conservation",0,0,0,0,0,0,0,1,0,0,0
"@frankturtleguy","frankturtleguy",0,0,0,0,0,0,0,0,0,0,1
"@becky_kostka","ancestry from rani reindeer herder norse celtic tribes indigenous wisdom facilitator conservation development enviro educator healer love laugh",0,0,0,0,1,0,0,0,0,0,0
"@interior","protecting americas great outdoors powering our future",0,0,0,0,0,0,0,0,0,0,1
"@janeyha88",NA,0,0,0,0,0,0,0,0,0,1,0
"@fixcoachchris","level 2 cycling coach at the fix studio contact me by email chris at thefixstudio dot com",0,0,0,0,0,0,0,0,0,0,1
"@giftcardbin","giftcardbin buy sell your gift cards through our guaranteed quick easy process your world on sale",0,0,0,0,0,0,0,0,0,0,1
"@chromeowl09",NA,0,0,0,0,0,0,0,0,0,1,0
"@campother","discussing tickborne infections immunology science medical controversy media portrayal of chronic illness the patient experience since 2010",0,0,0,1,0,0,0,0,0,0,0
"@biodiv","moving forward so we are at peace with nature",0,0,0,0,0,0,0,0,0,0,1
"@carlarh",NA,0,0,0,0,0,0,0,0,0,1,0
"@drmdwood","senior lecturer at university of salford environmental scientist specialising in radioecology",1,0,0,0,0,0,0,0,0,0,0
"@kinsella_cormac",NA,0,0,0,0,0,0,0,0,0,1,0
"@chloedalglish","ecologist msc biodiversity conservation grad trained at mammal research institute ecology conservation outdoors seeking work in reseach worldwide",0,0,0,1,0,0,0,0,0,0,0
"@cynthiasmoot","fox 13 news anchor reporter love horses wildlife all things animal greyhound mom naturelover story idea tweet me",0,0,0,0,0,0,1,0,0,0,0
"@iheartcities","urban enthusiast public engagement specialist sustainability nerd music lover aspiring cellist knitter bureaucrat but tweets are my own",0,0,0,0,0,0,0,0,0,0,1
"@arundelnsc","arundel nature science centre is an experiential education centre with a naturebased science environmental literacy focus",0,0,0,0,0,1,0,0,0,0,0
"@bioannie","princess of bayesia aka health policy statistician prof at harvard med school",1,0,0,0,0,0,0,0,0,0,0
"@columbiaurbanag","the columbia center for urban agriculture seeks to promote develop a sustainable local food system in columbia we know one thing for sure food is good",0,0,0,0,0,0,0,0,0,0,1
"@jessn262",NA,0,0,0,0,0,0,0,0,0,1,0
"@iamhugecereals","biology student at uiuc we like to have fun around here",0,1,0,0,0,0,0,0,0,0,0
"@chipheil","i specialize in environmental paleomagnetic studies of sediments rocks to understand climate change",0,0,0,0,0,0,0,0,0,0,1
"@anaisrassat","science researcher interested in technology innovation science policy member of euclidmission esa space mission tck mostly in geneva lausanne ch",0,0,0,0,0,0,0,1,0,0,0
"@jeskill","evidencebased treehugger data wrangler tweets are my own",0,0,0,0,0,0,0,0,0,0,1
"@davidhembry","evolutionary ecology island biogeography",0,0,0,1,0,0,0,0,0,0,0
"@haroon1234pk",NA,0,0,0,0,0,0,0,0,0,1,0
"@georgia_os","zoologist productive procrastinator at trinity college dublin",0,0,0,1,0,0,0,0,0,0,0
"@jeremyj_schmidt","banting fellow dalhousie water geography anthropology smoke mirrors",0,1,0,0,0,0,0,0,0,0,0
"@k3books",NA,0,0,0,0,0,0,0,0,0,1,0
"@froglifers","froglife is a wildlife charity dedicated to the conservation of frogs toads newts snakes lizards their disappearing habitats tweets by jenny leon",0,0,0,0,0,0,0,1,0,0,0
"@jilberk","seeking knowledge",0,0,0,0,0,0,0,0,0,0,1
"@garyrolfe","marine biology costal ecology graduate also tweeting about food herpetology everton fc poker science atheism f1 wife kids",0,0,0,1,0,0,0,0,0,0,0
"@ferrenasstrom",NA,0,0,0,0,0,0,0,0,0,1,0
"@abdouh","marie curie global fellow microbiologist science trotter",0,1,0,0,0,0,0,0,0,0,0
"@biologyfran","biologist mom amateur equestrian",0,0,0,1,0,0,0,0,0,0,0
"@envhumanities","environmental humanities is an international openaccess journal that aims to invigorate current interdisciplinary research on the environment",0,0,0,0,0,1,0,0,0,0,0
"@academicminute","from wamc northeast public r",0,0,0,0,0,0,0,0,0,0,1
"@avanosch",NA,0,0,0,0,0,0,0,0,0,1,0
"@dorisbiesenbach","bibliothekarin private twitterin",0,0,0,0,0,0,0,0,0,0,1
"@awesomizer","free your heart your soul will follow",0,0,0,0,0,0,0,0,0,0,1
"@clamsandoysters","vital news information about clams oysters scallops other bivalves plus coastal living seafood eating the study of marine life by jameserik",0,0,0,0,0,1,0,0,0,0,0
"@jessicamari3627",NA,0,0,0,0,0,0,0,0,0,1,0
"@courtneyvonw",NA,0,0,0,0,0,0,0,0,0,1,0
"@getsharp_eu",NA,0,0,0,0,0,0,0,0,0,1,0
"@jamestmyu",NA,0,0,0,0,0,0,0,0,0,1,0
"@jane_steranko","science radio talk show host emeritus science does not care about your opinions its not a person but a process",0,0,0,0,0,0,1,0,0,0,0
"@amresco","manufacturer supplier of high quality biochemicals reagents for molecular biology life sciences proteomics clinical histology areas of research",0,0,0,1,0,0,0,0,0,0,0
"@blount_8","the purpose of my life is to be used by god to further his kingdom",0,0,0,0,0,0,0,0,0,0,1
"@handbookforlove","ebook for lovers all you need about life love",0,0,0,0,0,0,0,0,0,0,1
"@afprobert","phd candidate at the university of auckland ecologist entomologist",0,1,0,0,0,0,0,0,0,0,0
"@keyurpatel94",NA,0,0,0,0,0,0,0,0,0,1,0
"@itsjuuuulie","aspiring marine biologist conservationist dog lover beach goer",0,0,0,1,0,0,0,0,0,0,0
"@attune2nature","sustainable environmental interpretation based in north yorkshire using art poetry creative installations to improve protect wildlife heritage",0,0,0,0,0,0,0,0,0,0,1
"@joehancuff","owner head trainer at fit philosophy",0,0,0,0,0,0,0,0,0,0,1
"@ecalv1",NA,0,0,0,0,0,0,0,0,0,1,0
"@180debs","allotment gardener darts player mum of 4 girls",0,0,0,0,0,0,0,0,0,0,1
"@kimberlyrondeau","if you sit with me for long enough you will walk away with a hastily drawn figure on the back of a napkin",0,0,0,0,0,0,0,0,0,0,1
"@1111linno","patient advocate artist blogger for everdayhealth mother of three surviving advanced lung cancer",0,0,0,0,0,0,1,0,0,0,0
"@dleowinata","making things more interesting inspiration conservation communication lover of all things magical directing media at apwfund",0,0,0,0,0,0,1,0,0,0,0
"@ibiris","technical program manager at linaro enterprise group raising a family sitting zazen practising iaido cooking surviving finland",0,0,0,0,0,0,0,0,0,0,1
"@heidireiswig",NA,0,0,0,0,0,0,0,0,0,1,0
"@arianaricarte","for social justice catholicism arts great reads andcats",0,0,0,0,0,0,0,0,0,0,1
"@angelabaggetta","book publicist goldberg mcduffie communications baker mama dog lover",0,0,0,0,0,0,1,0,0,0,0
"@drmiriam","clinical psychologist with an evolutionary slant strengthbased approach to mental health autism neurodiversity",0,0,0,1,0,0,0,0,0,0,0
"@bymjwalker","editor of bbc earth author of upcoming novels a blue monkey the cloud seekers by http tco yzfme1xyot",0,0,0,0,0,0,1,0,0,0,0
"@deanpokrajac","gis professional tech geek wildlife conservation enthusiast naualumni asualumni aztws webmaster",0,0,0,0,0,0,0,0,0,0,1
"@annecelinebags","all of anne celines stylish sustainable fabrics are made from 100 repreve recycled plastic ",0,0,0,0,0,0,0,0,0,0,1
"@hajnalkahejjamd","genomics epigenetics microparticles a medical doctor about biotechnology pharma industry drugsafety professional phd studentviews are my own",0,1,0,0,0,0,0,0,0,0,0
"@anankhan65",NA,0,0,0,0,0,0,0,0,0,1,0
"@_jimaustin","im the editor of science careers from science magazine stereophile contributing editor views are my own",0,0,0,0,0,0,1,0,0,0,0
"@aislinnpearson","bbsrcfunded phd student working at lancaster univeristy rothamsted research views are my own",0,1,0,0,0,0,0,0,0,0,0
"@kernowdeb",NA,0,0,0,0,0,0,0,0,0,1,0
"@gisrsgreenwich","official twitter feed for the centre for gis remote sensing at the university of greenwich current news updates",0,0,0,0,0,1,0,0,0,0,0
"@caryinstitute","news commentary from a leading environmental research organization committed to education outreach",0,0,0,0,0,0,1,0,0,0,0
"@jellyfishproj","a global coalition of musicians for our environment our future",0,0,0,0,0,0,0,1,0,0,0
"@amccnnll","phd resesrcher in arctic ecosystem dynamics at ucph i like polar science social democracy sexysocialism old boats disaster miserable weather ",0,0,0,1,0,0,0,0,0,0,0
"@harvardforest","harvards outdoor lab classroom for ecology conservation since 1907 one of the oldest most intensively studied research forests in north america",0,1,0,0,0,0,0,0,0,0,0
"@aliasymposium","alia artificial life intelligent agents symposium new academic event accepting papers supported by hpc wales expecting to publish with springer",0,0,0,1,0,0,1,0,0,0,0
"@jessielhenning","ohio lover with a raging appetite for wild places smiling eyes real food bare feet slugs",0,0,0,0,0,0,0,0,0,0,1
"@collinewald","postdoctoral fellow at harvard medical school blackwell lab research interest longevity healthy aging extracellular matrix neuroscience c elegans",0,1,0,0,0,0,0,0,0,0,0
"@aranocarroll","tenaciously pursuing solutions to conservation sustainable development executive director canadian boreal forest agreement secretariat cbfacanada",0,0,0,0,0,0,0,0,0,0,1
"@ahayn17","church is for brunettes danger i got mad boob skillz",0,0,0,0,0,0,0,0,0,0,1
"@amittailor_","undergrad student uoftmississauga goleafsgo wethenorth bluejays edm snapchat amittailor",0,1,0,0,0,0,0,0,0,0,0
"@drpauljamesuk","research fellow at the university of exeter as part of the microbial biofuels group",0,1,0,0,0,0,0,0,0,0,0
"@dubble0h","activism works so bring on the revolution awake journos must be4th estate anti censorship pr wbs stop chemtrailing our planetmonsanto sucks favs int",0,0,0,0,0,0,0,0,0,0,1
"@iowajeeper","jeep enthusiast",0,0,0,0,0,0,0,0,0,0,1
"@biotim","biologist phd student at stanford",0,1,0,0,0,0,0,0,0,0,0
"@alesiasmash",NA,0,0,0,0,0,0,0,0,0,1,0
"@ajjb80",NA,0,0,0,0,0,0,0,0,0,1,0
"@jmeesvliz","director of the flanders marine institute vliz chair of the european marine board",0,0,0,0,0,0,0,0,0,0,1
"@heaneylynne",NA,0,0,0,0,0,0,0,0,0,1,0
"@duran_labware","im the product manager of duran borosilicate glass laboratory products im interested in hearing your feedback about our products or ideas for improvements",0,0,0,0,0,0,0,0,0,0,1
"@helenaucaztegui","biologist microbiologist unam mxico study methane emissions in wetlands methanotrophic bacteria of xochimilco",0,1,0,0,0,0,0,0,0,0,0
"@acesaspen","aspen center for environmental studies aces provides programs in environmental literacy for everyone from school children to leaders decisionmakers",0,0,0,0,0,1,0,0,0,0,0
"@imbe_noumea","pacific office of the umr imbeird research group head ericvidalirdfr in island ecology invasion biology conservation of pacific islands",0,0,0,0,0,1,0,0,0,0,0
"@danbaldwinart","artist",0,0,0,0,0,0,0,0,0,0,1
"@genomebean","molecular ecologist genomicist writer photographer parttime professional vintage dancer besotted bengal cat owner",0,0,0,1,0,0,1,0,0,0,0
"@katiesci","newly minted phd preparing for a move to not sure yet city most of my tweets are about science some personal hopefully some are funny",0,0,0,0,0,0,0,0,0,0,1
"@danieldecanini","i like science podcasts way too much",0,0,0,0,0,0,1,0,0,0,0
"@alanashoo",NA,0,0,0,0,0,0,0,0,0,1,0
"@kasiamiko","msc student in biodiversity conservation management occasional tweets on nature sustainability environmental justice loves french bulldogs",0,1,0,0,0,0,0,0,0,0,0
"@birds_central","birder naturalist wildlife guide blogs at the grip nocatsoutside",0,0,0,1,0,0,1,0,0,0,0
"@canadianenv",NA,0,0,0,0,0,0,0,0,0,1,0
"@anag_fernandez","biloga passionate about my job love to travel amo el mar las tortugas y ballenas un caf por la maana y vinito por la noche ah y la vida me despeina",0,0,0,0,0,0,0,0,0,0,1
"@doreenstabinsky","professor of global environmental politics college of the atlantic focus my days nights on the global politics of climate change food",1,0,0,0,0,0,0,0,0,0,0
"@goodgracious23","limnologist ecologist aslo student board member",0,1,0,0,0,0,0,0,0,0,0
"@jvamosi","plant diversity enthusiast professor ucalgary senior editor methodsecolevol digs wine fiction tweets my own",1,0,0,0,0,0,0,0,0,0,0
"@charliewheatmbo","trainee oceanographer loves climbing piano camping tea puzzles skydiving",0,0,0,1,0,0,0,0,0,0,0
"@kagan20a","foodie economist coffee drinker ocean minded passionate about sustainable seafood ocean conservation responsible fishing",0,0,0,1,0,0,0,0,0,0,0
"@gentledna","web browser based dna design simple quick free extensible secure opensource for openscience magnusmanske synbiota mozwebfwd community supported",0,0,0,0,0,0,0,0,0,0,1
"@chatdessables","curiosity feeds the cathave a soft spot for science silence travel birds mild mannered scientist for the most part yay science",0,0,0,1,0,0,0,0,0,0,0
"@autolocus","always going forward never looking back what could possibly go wrong",0,0,0,0,0,0,0,0,0,0,1
"@erikrunquist","butterfly conservation biologist minnesota zoo butterflies pollinators prairie science ecology phd ucdavis tweets pics mine not rts born at 335ppm co2",0,0,1,0,0,0,0,0,0,0,0
"@alex__coleman","postdoc at tum germany phd at jic uk research interests in plantpathogen insect interactions enjoy science travelling sport good food fine ale",0,1,0,0,0,0,0,0,0,0,0
"@andries_richter",NA,0,0,0,0,0,0,0,0,0,1,0
"@dkinder30","blue ocean film festival exec director writer filmmaker parent",0,0,0,0,0,0,1,0,0,0,0
"@enviro_richard","account used by ricardodallison to monitor all things environment used particaulrly as serenbangors environment editor for my university modules",0,0,0,0,0,0,1,0,0,0,0
"@asa_cssa_sssa","american society of agronomy crop science society of america soil science society of america 3 societies 11000 members peerreviewed publications",0,0,0,0,0,1,0,0,0,0,0
"@joyemwatts","cheerleader for microbes using my skills in interpretative dance environmental microbiology ok i was lying about the dance",0,0,0,1,0,0,0,0,0,0,0
"@antinvasions","phd student ecologist entomologist yada yada",0,1,0,0,0,0,0,0,0,0,0
"@anasofgs","marine biologist conservationist selfproclaimed bird nerd passionate diver most likely found under several meters of seawater with a camera in hand",0,0,0,1,0,0,0,0,0,0,0
"@axel_photo_art","photographe artistique du naturel site http tco 6m81hrgb4m facebook http tco pbixb4n4yd instagram axelphotoart limoges axellp axelphoto",0,0,0,0,0,0,0,0,0,0,1
"@jonjonsson","husband father grandfather a lover of christ the author of search engines the book about the journey deep into your own creation",0,0,0,0,0,0,1,0,0,0,0
"@birdtours","nature tours at its best get the best rates on vacations tours relating to bird watching in jamaica see over 250 bird species to include 28 endemics",0,0,0,0,0,0,0,0,0,0,1
"@andreahitchon","grad student at uog ridgetown campus interested in agriculture insects of course rootworm beetles",0,1,0,0,0,0,0,0,0,0,0
"@joshatnrdc","working clean energy wildlife issues tweets are my own not officiallike",0,0,0,0,0,0,0,0,0,0,1
"@bookitlab","core facility management software get the most of your core facility contact us for a free demo",0,0,0,0,0,0,0,0,0,0,1
"@granthamcsf","a new collaboration between the grantham foundation for the protection of the environment shineproject rts are not necessarily endorsements",0,0,0,0,0,0,0,1,0,0,0
"@h_david_g","i play words with friends way way too much oh i love politics hashtag",0,0,0,0,0,0,0,0,0,0,1
"@iihsin","iihs is building indias first independent national research innovation university focussed on the challenges opportunities of its urbanisation",0,0,0,0,0,0,0,0,0,0,1
"@keasdenkate",NA,0,0,0,0,0,0,0,0,0,1,0
"@andreagarnier","rainbow chaser pot of gold locator finder of silver linings content creator at water tiger writing in yyc rmh",0,0,0,0,0,0,0,0,0,0,1
"@clynch_illwx","a geographer at heart if not in practice i do climate research knit all views are my own",0,0,0,1,0,0,0,0,0,0,0
"@buni2shy","gaming animals sci fi horror got me boys me business me health one happy person ",0,0,0,0,0,0,0,0,0,0,1
"@427896","research scholar bose institutekolkata",0,0,0,1,0,0,0,0,0,0,0
"@jeffreybweiss",NA,0,0,0,0,0,0,0,0,0,1,0
"@act_wild","actwild inspires enables people to protect endangered wildlife through advocacy travel volunteering raise your voice get your hands dirty act",0,0,0,0,0,0,0,0,0,0,1
"@drlouisechughes","electron microscopist at oxford brookes university skeptic innovator atheist kinkster microscopy website http tco gjmkhtoce4",0,0,0,0,0,0,0,0,0,0,1
"@ejscbc","conservation biologist educator emerging foodie",0,0,0,1,0,0,0,0,0,0,0
"@getmore_click",NA,0,0,0,0,0,0,0,0,0,1,0
"@absentfriendcmb",NA,0,0,0,0,0,0,0,0,0,1,0
"@evo_audrey","university of washington biologist homo sapiens",0,0,0,1,0,0,0,0,0,0,0
"@evofish_uib","evolutionary ecology with fish flavour at the university of bergen we use models statistics experiments with guppies daphnia salmon louse",0,0,0,1,0,0,0,0,0,0,0
"@kentarantus","onthology biodiversity conservation",0,0,0,1,0,0,0,0,0,0,0
"@allisonkronberg","environment reporter mndailynews reporter for murphynews pursuing ba journalism at the university of minnesota all posts are my own opinions",0,0,0,0,0,0,1,0,0,0,0
"@ausambusa","the hon kim beazley ac is australias ambassador to the us the ambassadors tweets are signed kb for consular assistance please see http tco ogjdhjzhc8",0,0,0,0,0,0,0,0,0,0,1
"@aysegulcetin32",NA,0,0,0,0,0,0,0,0,0,1,0
"@hamiltonisland","the official twitter account for hamiltonisland home of qualia wildoatsxi audi hamilton island race week ahirw the hiyachtclub",0,0,0,0,0,0,0,0,0,0,1
"@brimleybball","girls basketball coach dad husband",0,0,0,0,0,0,0,0,0,0,1
"@kayleighfawcett","senior ecologist bats thermographer passionate about thermal imaging with bats phd in bat echolocation",0,0,0,1,0,0,0,0,0,0,0
"@freestone_david",NA,0,0,0,0,0,0,0,0,0,1,0
"@alecchamilton","morning producer wnyc all opinions are my own",0,0,0,0,0,0,1,0,0,0,0
"@dnaliveforever","dna time travelers health for now but mainly in the future genetic genome health for your families future http tco kiu7pfdgh1",0,0,0,0,0,0,0,0,0,0,1
"@ashkan_j","biomed student at uw just listen to the music maaaan",0,1,0,0,0,0,0,0,0,0,0
"@edenextdmt","edenext data management team biology control of vector borne infections in europe funded by fp7 46 partners over 22 countries 20112014",0,0,0,1,0,0,0,0,0,0,0
"@climatekicstart","climatekic learning hub discussion forum on climatescience entrepreneurship innovation climatechange climateaction",0,1,0,0,0,0,0,0,0,0,0
"@emilyyoung92","phd student at university of hawaii at manoa studying deepsea organicfall habitats",0,1,0,0,0,0,0,0,0,0,0
"@joedelbianco","were a little messed up but were all alright",0,0,0,0,0,0,0,0,0,0,1
"@danmaclean","bioinformatics genomics evolution plants pathogens open science training head of bioinformatics at the sainsbury laboratory senior lecturer",1,0,0,0,0,0,0,0,0,0,0
"@amazingtunisia","tunisia the amazing land",0,0,0,0,0,0,0,0,0,0,1
"@cambridgewg","a working group with the goal of finding consensus on the creation of potential pandemic pathogens account maintained by marcelsalathe neva9257",0,0,0,0,0,0,0,0,0,0,1
"@ghostponds","follow the ghost ponds project other exciting freshwater news",0,0,0,0,0,0,1,0,0,0,0
"@hromadamartin",NA,0,0,0,0,0,0,0,0,0,1,0
"@ceepsustain","the center for energy env policy ceep is a leading institution for interdisciplinary research education in energy environmental policy udelaware",0,0,0,0,0,1,0,0,0,0,0
"@aslexeter","behavioural ecologist interested in the ecology evolution of social behaviour opinions are mine alone",0,0,0,1,0,0,0,0,0,0,0
"@authorlmtaylor","im 24 traveled the world been in the army got a bs in physics attended grad school now im an author who knows what shenanigans ill get into next",0,0,0,0,0,0,1,0,0,0,0
"@biomimicry_uk","uk biomimicry social enterprise sharing natures wisdom tweets by richmaccowan please ask us questions",0,0,0,0,0,0,0,0,0,0,1
"@_scogg","sydney climate activist italian speaker tea drinker nature lover campaigner world explorer cheeseaholic",0,0,0,0,0,0,0,0,0,0,1
"@dewyvantol","science nerd",0,0,0,0,0,0,0,0,0,0,1
"@bwriverkeeper","black warrior riverkeeper is a nonprofit organization whose mission is to protect restore the black warrior river its tributaries",0,0,0,0,0,0,0,1,0,0,0
"@daleymaths","theoretical computer scientist seduced into computational biology neuroscience",0,0,0,1,0,0,0,0,0,0,0
"@erikamcshaw","director western washington university shannon point marine center coastal oceanography sediment nutrient transport hypoxia ocean acidification",0,0,0,0,0,1,0,0,0,0,0
"@euoea","ocean energy europe is the trade association for ocean renewables in europe",0,0,0,0,0,0,0,0,0,0,1
"@helenmperkins","living landscape development manager for the wildlife trusts tweets are my own",0,0,0,0,0,0,0,0,0,0,1
"@craigkausen","a dreamer grandson of grinch looney tunes director chuck jones pres chuck jones cos smile its contagious",0,0,0,0,0,0,0,0,0,0,1
"@eyesonthebay","maryland chesapeake bay coastal bays water quality information from the maryland department of natural resources",0,0,0,0,0,0,0,0,0,0,1
"@allen2cia","masters student uwsafs in fisheries modeling management",0,1,0,0,0,0,0,0,0,0,0
"@8chandlerbrooks",NA,0,0,0,0,0,0,0,0,0,1,0
"@fahdfr_","budding scientist cancer research retail professional contact networking fahdfrehmanoutlookcom",0,0,0,1,0,0,0,0,0,0,0
"@greengirls","sustainably powered by girls tweets from applelevy",0,0,0,0,0,0,0,0,0,0,1
"@defender_hank","pike fly fisher wildlife lover a single malt whisky guru",0,0,0,0,0,0,0,0,0,0,1
"@cyrannejo",NA,0,0,0,0,0,0,0,0,0,1,0
"@johncwright2","retired phd marine biologist mainly a fish guy likes palaeoanthropologyevolutionary biology",0,0,0,1,0,0,0,0,0,0,0
"@boydmori","phd student entomologist",0,1,0,0,0,0,0,0,0,0,0
"@anxiousmedic","michael kruse is a paramedic a science advocate a founder of badsciencewatch a semiretired theatrical lighting designer opinions are my own",0,0,0,0,0,0,0,0,0,0,1
"@birdinthewild","artist who likes the outdoors adventure",0,0,0,0,0,0,0,0,0,0,1
"@diogoprovete","phd in ecology evolution postdoc at gothenburg editor for amphibiareptilia j biodiversity data eic of check list open science knowledge activist",0,1,0,0,0,0,0,0,0,0,0
"@amdrews","student of biological anthropology",0,1,0,0,0,0,0,0,0,0,0
"@ariodzernbc6","i am a reporter for wtvj nbc6 miami grew up in sofla went to deerfield beach high school uf grad married to sharilynn odzer 3 kids go gators heat",0,0,0,0,0,0,1,0,0,0,0
"@byronjsmith","microbial ecology phd student at the university of michigan",0,1,0,0,0,0,0,0,0,0,0
"@jerry_walch","im a 71 yearold christian street minister freelance christian writer",0,0,0,0,0,0,1,0,0,0,0
"@botanyem","botanist kewgardens wildlife baking craft fan views are my own",0,0,0,1,0,0,0,0,0,0,0
"@jp_metzger","landscape ecologist professor at the university of sao paulo",1,0,0,0,0,0,0,0,0,0,0
"@golfdiscounttra","golf discount travel has been in the golf business since 1977 our experience over the years allows us to package the perfect golf vacation at an amazing price",0,0,0,0,0,0,0,0,0,0,1
"@intheblu","inspired by the oceans theblu is a sociallyconnected global interactive app explore connect learn support ocean conservation get it now free theblucom",0,0,0,0,0,0,0,0,0,0,1
