"Username","bio","faculty","student","mza","other.sci","outreach","sci.assoc","media","applied","politician","unknown","public"
"@betenoire1",NA,0,0,0,0,0,0,0,0,0,1,0
"@beefriendlys","we make beautiful packets of beefriendly wild flower seeds to grow plants rich in nectar pollen to help save our bees pick up a pack today",0,0,0,0,0,0,0,0,0,0,1
"@kasiamusial","chief of social sustainability lstkronoberg promotes sustainable decision making ethical behavior social justice environmental care",0,0,0,0,0,0,0,0,0,0,1
"@allohexaploid","geneticist pathologist with research interests in crops for the future noise techno acetate enthusiast in my spare time ",0,0,0,1,0,0,0,0,0,0,0
"@cultivate_ie","permaculture courses green building community resilience events more bbconf sustainableireland",0,0,0,0,0,0,0,0,0,0,1
"@jared_streich",NA,0,0,0,0,0,0,0,0,0,1,0
"@ed_reckoning","web developer for amusedomcom web publishing by artists to serve artists periodically afflicted with obsessivecompulsive detailed drawing disorder ocddd",0,0,0,0,0,0,1,0,0,0,0
"@alyxei1","writer masters student politically militant by necessity",0,1,0,0,0,0,0,0,0,0,0
"@aemarcy","biologist educational game designer current fulbright scholar in australia",0,1,0,0,0,0,0,0,0,0,0
"@annicac",NA,0,0,0,0,0,0,0,0,0,1,0
"@bethskw","science writer interested in complex workings of the human body microbiomes more",0,0,0,0,0,0,1,0,0,0,0
"@fishnmen","a film that explores the changing fishing industry while attempting to help the consumer the environmentalist the fisherman ocean conservation",0,0,0,0,0,0,1,0,0,0,0
"@getleashed","a digital hub for modern pet owners lifestyle celebrity travel fashion home health tips treats the pets you love",0,0,0,0,0,0,0,0,0,0,1
"@angelsharpmedia","documentary factual film production house tweets from hannah daniel jonathan titas",0,0,0,0,0,0,1,0,0,0,0
"@anonymouskenya1","conscience of kenya humanrights truth justice freedom equality anonymous stopthensa opfunkill rts are not endorsements",0,0,0,0,0,0,0,0,0,0,1
"@engelhardgeorg","marine biology fisheries historical ecology climate change",0,0,0,1,0,0,0,0,0,0,0
"@gonency",NA,0,0,0,0,0,0,0,0,0,1,0
"@carlottamkm","35 years 1 degree in fashion 4 years 1 2 a degree in emergency response natural science business administration a full time mom d",0,0,0,0,0,0,0,0,0,0,1
"@heatherkoldewey","head of zsls global conservation programmes zslconservation zslmarine nets2carpet cofounded project seahorse projectseahorse cornwallall tweets my own",0,0,0,0,0,1,0,0,0,0,0
"@eamoll","interested in technology science culture communications the humanities the arts all the ways these different fields interact",0,0,0,0,0,0,1,0,0,0,0
"@ericnost","political ecology ecosystem services markets ecological restoration climate law big data the environment phd student uwmadisongeog",0,1,0,0,0,0,0,0,0,0,0
"@drbob5018","gibraltarian ornithologist chartered scientist fsb fibms pastchairman of bto rnc committee hold ringing a permit medical scientist",0,0,0,1,0,0,0,0,0,0,0
"@girlgonwildlife","aspiring marine conservationist slight workaholic huge nerd superbly weird devoted lover full of life adventure seeker",0,0,0,0,0,0,0,0,0,0,1
"@christianstolt","you gotta have an opinion meningsdanner in spe political science biology at university of copenhagen underviser",0,0,0,1,0,0,0,0,0,0,0
"@emilykate1smith","researching the interactions of traffic tillage on soil crop properties harperadamsuni",0,0,0,0,0,0,0,0,0,0,1
"@alexhudsonriver","fundraiser for the olana partnership enjoy social media strategy theory graphic design persuasion hudson socialmobile",0,0,0,0,0,0,0,0,0,0,1
"@freelancejoe","publicist for teambossygals check out the building of the first all female dominated conglomerate here http tco l0j5i04gnc",0,0,0,0,0,0,0,0,0,0,1
"@growandeat2013","grow eat is a cambridgeshire online garden community",0,0,0,0,0,0,0,0,0,0,1
"@jtn1965",NA,0,0,0,0,0,0,0,0,0,1,0
"@johnwheeler811","climbing tall things throwing rubber at fish spending time in or around water since 95 marine biologist",0,0,0,1,0,0,0,0,0,0,0
"@heliconiuscydno","i write about biomimicry nanoscience in books for the guardian independent teach narrative nonfiction at city university rlf fellow at gosh",1,0,0,0,0,0,0,0,0,0,0
"@gambletaylor",NA,0,0,0,0,0,0,0,0,0,1,0
"@kawikawest",NA,0,0,0,0,0,0,0,0,0,1,0
"@earthfixmedia","pnw environment news multimedia pubmedia partners opb kuow kcts9 iptv nwpr klcc jpr http tco 5ojnwwy5pr",0,0,0,0,0,0,1,0,0,0,0
"@burcugumustekin","gz yanla da elenir onu da alpsatar bu dnya",0,0,0,0,0,0,0,0,0,0,1
"@dohnemus","postdoctoral research scientist in chemical oceanography",0,1,0,0,0,0,0,0,0,0,0
"@ant_ibiotics","leafcutter ants use antibiotics just like us come see us at the big bang science fair 2015 we live on the norwich research park with matthutchings10",0,0,0,0,0,0,0,0,0,0,1
"@amsciam","senior editor farrar straus giroux i oversee the scientific american fsg novel graphics imprints i like science books science books",0,0,0,0,0,0,1,0,0,0,0
"@hpmurphy","research communications manager at the open university but my tweets are my own love dogs fresh air ballroom dancing literature meditation",0,0,0,0,0,0,1,0,0,0,0
"@eyeonthearctic","a radio canada international web site eye on the arctic brings together circumpolar media focused on the arctic climate adaptation",0,0,0,0,0,0,1,0,0,0,0
"@ban_challenge","ban the booze cigarettes sugar whatever youre having yourself for the month of january for charity",0,0,0,0,0,0,0,1,0,0,0
"@caromoussy","postdoc at musum national dhistoire naturelle field lab ecologist movement ecology zoology behaviour evolution conservation",0,1,0,0,0,0,0,0,0,0,0
"@amsevas","homo sustainable",0,0,0,0,0,0,0,0,0,0,1
"@adrianburton_","biologist science writer usually found at a computer or crawling after some animal get my life lines column free at http tco 9i5brwjzny tweets are my own",0,0,0,1,0,0,1,0,0,0,0
"@biomech_keith","northwestern university director of the human agility lab rehab robotics neuromechanical contol of gait spinal cord injury",0,0,0,0,0,0,0,0,0,0,1
"@charlotte36339","i love entomology moth paleontology reptiles amphibians aquarium fossil plants ",0,0,1,0,0,0,0,0,0,0,0
"@ersilia","aspiring intelligent designer",0,0,0,0,0,0,0,0,0,0,1
"@joshuagoodstein",NA,0,0,0,0,0,0,0,0,0,1,0
"@cerfscience","coastal estuarine research federation",0,0,0,0,0,0,0,0,0,0,1
"@electricpressls","7 restaurants bars 1 theatre in a grade ii listed building next to millennium square follow us for offers updates",0,0,0,0,0,0,0,0,0,0,1
"@exeterstudent","exeter freshers students 2015 2016 all the info for freshers sept 15 unbiased views mention for any rt clubs shows offers food etc",0,0,0,0,0,0,0,0,0,0,1
"@anticsbam","technical writers technically",0,0,0,0,0,0,0,0,0,0,1
"@asunseo","a pesar del pib no vamos a desfallecer seo birdlife contagiar a toda la sociedad su conviccin el medio ambiente es parte de la solucin",0,0,0,0,0,0,0,1,0,0,0
"@bonniec221",NA,0,0,0,0,0,0,0,0,0,1,0
"@drtryan","msf ridercoach science teacher",0,0,0,0,1,0,0,0,0,0,0
"@hanks_thomson","grad student evolution bioinformatics microbiology pathogen adaptation antibiotic resistance pseudomonas i dont study insects but they look nice",0,1,0,0,0,0,0,0,0,0,0
"@jenturn3r","i work for the rspb its my job to grow support for nature from businesses i love my husband friends job rock music the planet in general tweets my own",0,0,0,0,0,0,0,0,0,0,1
"@farishte_p",NA,0,0,0,0,0,0,0,0,0,1,0
"@joycewong77",NA,0,0,0,0,0,0,0,0,0,1,0
"@ivan_cestari","fatherbikerswimmerenvironmental engineer",0,0,0,0,0,0,0,0,0,0,1
"@barbaragdooley","i am a freelancer writer i mastered the field of health currently im working with my friends to make a perfect blog about health",0,0,0,0,0,0,1,0,0,0,0
"@dakkaynak","oceanographerdiverengineer trying to get http tco ntgxbxogp6 off the ground tweets in english turkish urlaldalg mhendisokyanus bilimci",0,0,0,0,0,0,0,0,0,0,1
"@ainopa",NA,0,0,0,0,0,0,0,0,0,1,0
"@foodfotogallery","gorgeous food fotos posted daily share yours at",0,0,0,0,0,0,1,0,0,0,0
"@fdrenn","music teacher improving classical guitarist space exploration advocate",0,0,0,0,1,0,0,0,0,0,0
"@chemist_ahmed22",NA,0,0,0,0,0,0,0,0,0,1,0
"@gaggle_k12","safe k12 communication collaboration learning follow gagglesafety need help use gagglesupport or email supportathttp tco bpggiuuitk",0,0,0,0,0,0,1,0,0,0,0
"@jaime_mcclain",NA,0,0,0,0,0,0,0,0,0,1,0
"@bogfossil","dad paleobiogeochemist peatland lover",0,0,0,1,0,0,0,0,0,0,0
"@claudialgray","postdoc in ecology conservation researching impacts of human activity landscape management on biodiversity ecosystem services",0,1,0,0,0,0,0,0,0,0,0
"@edglucksman","researcher at uniofexeteresi responsible mining practices science communication policy microbiology coauthor of http tco rtfkbp9kre",0,0,0,0,0,0,1,0,0,0,0
"@kjfverhoeven",NA,0,0,0,0,0,0,0,0,0,1,0
"@jbgwct",NA,0,0,0,0,0,0,0,0,0,1,0
"@amandanewsom","my favorite things are nonprofits animals traveling anthropology food shoes",0,0,0,1,0,0,0,0,0,0,0
"@ecgilmartin","fungal ecology person researching heartrot casual botanist occasional birder",0,0,0,1,0,0,0,0,0,0,0
"@celiacackowski","biologist artist educator",0,0,0,1,0,0,0,0,0,0,0
"@jobirtus","australian wildlife carer whitehut wildlife welfare coastal conservation the coorong south australia animal activist",0,0,0,0,0,0,0,0,0,0,1
"@eeric1028",NA,0,0,0,0,0,0,0,0,0,1,0
"@comedyaiiday","no",0,0,0,0,0,0,0,0,0,0,1
"@foaylward","postdoc at the uhmanoa center for microbial oceanography research education cmore studying microbial ecology bioinformatics metagenomics",0,1,0,0,0,0,0,0,0,0,0
"@d_akkers","dakakkers rooftopcrops stadslandbouw rooftopfarm urbanfarming rooftopbees bijen milieucentrum luchtsingel bindergroen stadsinitiatief",0,0,0,0,0,0,0,0,0,0,1
"@ecomont_lara",NA,0,0,0,0,0,0,0,0,0,1,0
"@alesandra_lucia",NA,0,0,0,0,0,0,0,0,0,1,0
"@envstudiesp","an education conservation organization headquartered on a 914 acre field station apiary just north of warrenton virginia",0,0,0,0,0,1,0,0,0,0,0
"@flyangleruk",NA,0,0,0,0,0,0,0,0,0,1,0
"@clyde_crashcup","general science geek professional entomologist specialist in the prevention of tickborne diseasesvery preventable ask me how",0,0,0,1,0,0,0,0,0,0,0
"@dleuchtman","university of missouri plant biology graduate student",0,1,0,0,0,0,0,0,0,0,0
"@dustrubenstein","associate professor at columbia university behavioral ecologist field biologist who spends too much time in front of a computer explorer of social evolution",1,0,0,0,0,0,0,0,0,0,0
"@gcebayreuth","a msc program dedicated to understand analyse global change phenomena also sharing information of courses jobs offers latest news of climate change",0,0,0,0,0,0,1,0,0,0,0
"@exconomist","breaking the laws of economics statistics beyond a reasonable doubt most often not in a good way also i used to do computer science i like the ocean",0,0,0,1,0,0,0,0,0,0,0
"@jkconsuegra",NA,0,0,0,0,0,0,0,0,0,1,0
"@blogadoocom",NA,0,0,0,0,0,0,0,0,0,1,0
"@explorethecoast","stunning landscapes nature culture heritage news events updates from the north devon coast areas of outstanding natural beauty",0,0,0,0,0,0,1,0,0,0,0
"@elisewardrop","mcgill animal health disease undergrad student macdonald dairy farm vet tech",0,1,0,0,0,0,0,0,0,0,0
"@bielfrontera","matemtic a mig cam entre la docncia i la informtica inquiet",0,0,0,0,0,0,0,0,0,0,1
"@adelfanti","from piacenza to university of california davis author of biohackers the politics of open science devoto di san precario",0,0,0,0,0,0,1,0,0,0,0
"@coopermarie","i like thunderstorms i hate sleeping in",0,0,0,0,0,0,0,0,0,0,1
"@coralluzza","loves sharks measuring fishes meeting fishers in mediterraneanfao consultant on cites commerciallyexploited aquatic specieshere just my thoughts",0,0,0,0,0,0,0,0,0,0,1
"@bsandvicensis","nmfs biologist who speaks english spanish pidgin active sassy progressive bird were an endangered breed apart",0,0,0,1,0,0,0,0,0,0,0
"@ecojustice_ca","as canadas only national environmental law charity ecojustice is building the case for a better earth",0,0,0,0,0,0,0,1,0,0,0
"@fishgal42","i am an economist at noaas northwest fisheries science center this account is my own does not represent agency policy or endorsement",0,0,0,1,0,0,0,0,0,0,0
"@andreinstinct","try",0,0,0,0,0,0,0,0,0,0,1
"@inigopalacios"," el mar lo cura todo cuida el ecosistema the sea cures everything watch the ecosystem please followers 18 years aos",0,0,0,1,0,0,0,0,0,0,0
"@andrewwords","gotta love that science",0,0,0,0,0,0,0,0,0,0,1
"@drdelittle",NA,0,0,0,0,0,0,0,0,0,1,0
"@evotar_fp7",NA,0,0,0,0,0,0,0,0,0,1,0
"@anthropocenei",NA,0,0,0,0,0,0,0,0,0,1,0
"@izolagerety9137","i think we live in a very exciting time i am happily here to share information quotes about a conscious living nature sustainable living",0,0,0,0,0,0,0,0,0,0,1
"@cretaegus","ecology geek roleplaying boardgame geek scifi geek real ale geek despite being so cool i am also a husband father",0,0,0,1,0,0,0,0,0,0,0
"@archington_1991","zoology graduate of ucc studying msc in computational methods in ecology evolution at imperial college london love dogs mangos otters that can dance",0,1,0,0,0,0,0,0,0,0,0
"@fossilsandfilms","animation student at columbia college chicago volunteer in the geology department at the field museum",0,1,0,0,0,0,0,0,0,0,0
"@judykwalker","writer science geek lover of limu lychee alliteration author of the sydney brennan mysteries",0,0,0,0,0,0,1,0,0,0,0
"@cullen_thomas","phd student at the university of toronto researching palaeobiology plaid shirt enthusiast studier of ancient life http tco ywlj0vxss9",0,1,0,0,0,0,0,0,0,0,0
"@edencotteejones","dphil candidate school of geography the environment university of oxford",0,1,0,0,0,0,0,0,0,0,0
"@gretch_jukebox","secret agent motorcycle amateur dreamstomper hurricanes caniac doglover bar fly ninja assassin",0,0,0,0,0,0,0,0,0,0,1
"@billybenzz","just dodging astroids",0,0,0,0,0,0,0,0,0,0,1
"@adelina1984","conservation biologist working with pangolins small carnivores http tco 9fh0quxojx",0,0,0,1,0,0,0,0,0,0,0
"@avflox","science sex thankyou notes have written for la times village voice la weekly vice gizmodo",0,0,0,0,0,0,0,0,0,0,1
"@karenjeanhood","author poet freelance writer researcher child advocate feminist teacher literacy advocate cook food writer wife mom of 16 great kids foster kids",0,0,0,0,1,0,0,0,0,0,0
"@gregstoneci","marine biologist author explorer 8000 dives evp head of science oceans for conservationorg working every day to protect nature people",0,0,0,1,0,0,1,1,0,0,0
"@andrewxhill","former biologist developer mapper now an explorer of things cartodb",0,0,0,1,0,0,0,0,0,0,0
"@debbiespenard","this account is locked pls use my new account debbiespenardl an ass has hacked this account",0,0,0,0,0,0,0,0,0,0,1
"@jensmischief","communications professional trying to make the world a fairer place currently engaging londons youth in sustainable behaviour active participation",0,0,0,0,0,0,1,0,0,0,0
"@esa_titles","talk titles from esa2015 in an alternate universe created by noamross using davidjayharriss titlebot not affiliated with esaorg no robot section yet",0,0,0,0,0,0,0,0,0,0,1
"@eduardopareja","ceo founder at era7 bioinformatics",0,0,0,1,0,0,0,0,0,0,0
"@blueyouag","blueyou is an internationally recognized consulting service company focused on sustainable fisheries aquaculture their related seafood supply chains",0,0,0,0,0,0,0,0,0,0,1
"@hihinews","integrating science conservation of threatened island endemic birds institute of zoology hihi group tweets by john ewen patricia brekke students",0,1,0,0,0,0,0,0,0,0,0
"@hayleygrainger","broadcast journalist for heartwestnews heartglosnews heartwiltsnews addicted to shopping chocolate all views are my own",0,0,0,0,0,0,1,0,0,0,0
"@aelawild","an up coming wildlife biologist with a passion for animals wildlife a love of being outdoors im a naturalist a conservationist student of nature",0,1,0,0,0,0,0,0,0,0,0
"@birdoculars","avid birder blogger helping others create their own back yard sanctuaries its already there you just have to uncover it",0,0,0,0,0,0,1,1,0,0,0
"@2014techgirl","ceo of go girls engineering movementweb developperweb graphic designerpassionated about astronomy astrophysicspractice modern classic dance",0,0,0,1,0,0,0,0,0,0,0
"@alisonappling",NA,0,0,0,0,0,0,0,0,0,1,0
"@janehardingexe","international alumni events at university of exeter cyclist beekeeper gardener loves travel nature outdoors craft food tweeting my own views",0,0,0,0,0,0,0,0,0,0,1
"@eziahp","ezia athletic club is the fitness industry leader in delivering fun results driven programs fitness training gym wellness physicaltherapy",0,0,0,0,0,0,0,0,0,0,1
"@cpappas","founder of the elearning industrys network elearning blogger edutechpreneur elearning analyst speaker social media addict",0,0,0,0,0,0,1,0,0,0,0
"@gcccop20",NA,0,0,0,0,0,0,0,0,0,1,0
"@jamesbeissel","wildlife photographer on a quest to photograph the mammals of colorado beyond",0,0,0,0,0,0,1,0,0,0,0
"@katelyngeleynse",NA,0,0,0,0,0,0,0,0,0,1,0
"@boardshortsben","cofounder of projectseagrass marine ecologist aspiring adventurer photographer",0,0,0,1,0,0,1,0,0,0,0
"@generaenergy","genera energy inc supplies biomass feedstocks for the advanced biofuels biopower biochemical industries",0,0,0,0,0,0,0,0,0,0,1
"@bonuseventusag","bonus eventus bountiful food agriculture",0,0,0,0,0,0,0,0,0,0,1
"@adorabledian","i am a happy woman ",0,0,0,0,0,0,0,0,0,0,1
"@kimcormack","authormom lover of immature shenanigans dystopian paranormal romance children of ankh series sweet sleep enlightenment http tco h0zrhrykn5",0,0,0,0,0,0,0,0,0,0,1
"@calvoroy","periodista cientifico desde mediados de los 80 voy y vengo de una trinchera a otra presido la aecomcientifica http tco tpbpm7m1",0,0,0,0,0,0,1,0,0,0,0
"@katekatebear","cofounder of bmoretoned toneitup underamour ambassador surfsetfitness instructor natlaquarium media mgr lover of croissants sunshine ",0,0,1,0,0,0,0,0,0,0,0
"@domedward1","evolutionary biologist at liverpool uk sexual selection sexual conflict sperm competition mate choice works with small mammals exdrosophilist rphile",0,0,0,1,0,0,0,0,0,0,0
"@didacticd","didactic discourse is a showcase of young minds reviewing current trends news we are a group of designers looking for an outlet",0,0,0,0,0,0,1,0,0,0,0
"@astridsrsly","ocean cetacean aficionado animal lover blackfish emptythetanks captivitykills opkillingbay opseaworld",0,0,0,0,0,0,0,0,0,0,1
"@beatsnz","hod science edean at waiau area school",0,0,0,0,0,0,0,0,0,0,1
"@attenomis21","ecohydrology biogeochemistry fluid mechanics of environmental interfaces",0,0,0,1,0,0,0,0,0,0,0
"@bookshrike","books birds balls of the tennis variety",0,0,0,0,0,0,0,0,0,0,1
"@jackdunkley1",NA,0,0,0,0,0,0,0,0,0,1,0
"@k_d_jones","executive dean of science engineering cyber security researcher",1,0,0,0,0,0,0,0,0,0,0
"@cerystrayner","planning an expedition wild camping hiking in the 42 wild land areas of scotland http tco j075kfoygn",0,0,0,0,0,0,0,0,0,0,1
"@fatimafoflonker","phd candidate microbial biology rutgers",0,1,0,0,0,0,0,0,0,0,0
"@katelaskowski","behavioral ecologist beer drinker",0,0,0,1,0,0,0,0,0,0,0
"@halford1nigel",NA,0,0,0,0,0,0,0,0,0,1,0
"@dr4aj4eva","mother of 3 lovely children engaged to andrew johnson animal lover born again christian",0,0,0,0,0,0,0,0,0,0,1
"@greencollarvet","support us as we work to transition our veterans from the active duty services into sustainable green careers",0,0,0,0,0,0,0,0,0,0,1
"@drrichsmith","sensory physiologist openaccess science fan hs stem outreach mentor current nsf grf umd",0,0,0,1,0,0,0,0,0,0,0
"@elgazette","news for the english as a foreign language teaching english medium education industries worldwide matt salusbury does the tweets assisted by claudia",0,0,0,0,1,0,0,0,0,0,0
"@basham8888","operative",0,0,0,0,0,0,0,0,0,0,1
"@jwfondon3",NA,0,0,0,0,0,0,0,0,0,1,0
"@biomedoutfitter",NA,0,0,0,0,0,0,0,0,0,1,0
"@alisoncharvey1",NA,0,0,0,0,0,0,0,0,0,1,0
"@ccforgy","incoherent thoughts on quantum coherence other points of interest",0,0,0,0,0,0,0,0,0,0,1
"@bakercom1","im a prolific freelance journalist author aka a workaholic suffering from intense curiosity in all things http tco hf3yxanv",0,0,0,0,0,0,1,0,0,0,0
"@jayfamiglietti","hydrologist nasa jpl senior water scientist uc irvine professor",1,0,0,0,0,0,0,0,0,0,0
"@andreilopuchin",NA,0,0,0,0,0,0,0,0,0,1,0
"@graciebrazilian","brazilian jiu jitsu classes gym for women kids gracie sydney alexandria provides jiu jitsu training in sydney australia",0,0,0,0,0,0,0,0,0,0,1
"@curiously_megan","laboratory manager at a ubc yeast genetics lab tweeting about science sustainability issues vancouverite scientist foodie enviromentalist runner",0,0,0,1,0,0,0,0,0,0,0
"@cherissedupreez","marine ecologist phd candidate university of victoria",0,1,0,0,0,0,0,0,0,0,0
"@fiskeforbrains","marine ecology phd candidate at uow fishthinkers research group football tragic proud captain of woononafc",0,1,0,0,0,0,0,0,0,0,0
"@bergatsea","msc student currently looking into seabirds as ocean indicators ocean addict with a passion for seabirds marine mammals sailing photography",0,1,0,0,0,0,0,0,0,0,0
"@katrinavangrouw","author of the unfeathered bird former bird curator at the natural history museum graduate of the royal college of art",0,0,1,0,0,0,0,0,0,0,0
"@byebycatch","marine biologist all about shark behaviour sustainable fisheries art science mashups tweets my own opinions",0,0,0,1,0,0,0,0,0,0,0
"@kevinhrusovsky","family buckeye global health revolutionary collaborating to eradicate disease personalize health affordable accessible healthcare all views are my own",0,0,0,0,0,0,0,0,0,0,1
"@gzaleznat","microbiology genetics franais deutsch phd work in progress love travelling",0,0,0,1,0,0,0,0,0,0,0
"@franeviso","evolutionary ecologist doing research on lifehistory evolution population genetics ecological interactions community ecology",0,0,0,1,0,0,0,0,0,0,0
"@apcrdity","asiapacific center for regenerative design",0,0,0,0,0,0,0,0,0,0,1
"@avoidableco2","helping save the planet from avoidable co2 climate change",0,0,0,0,0,0,0,0,0,0,1
"@jhonrafaelblade",NA,0,0,0,0,0,0,0,0,0,1,0
"@hoekmandavid","teaching ecology at snu",0,0,0,0,1,0,0,0,0,0,0
"@elotroalex","digital scholarship coordinator at columbia university archival swashbuckler otramerican extraordinaire",0,0,0,0,0,0,0,0,0,0,1
"@henryish2014",NA,0,0,0,0,0,0,0,0,0,1,0
"@alessio_r_","marine scientist leader of the sea level coastal changes group at marumde leibnizwgl zmt adjunct lamontearth opinions my own",0,0,0,1,0,0,0,0,0,0,0
"@aumissandra",NA,0,0,0,0,0,0,0,0,0,1,0
"@billofthebirds","my name is bill i am a bird watcher i am also the editor of bird watchers digest magazine the host of the this birding life podcast",0,0,0,0,0,0,1,0,0,0,0
"@aftab6104",NA,0,0,0,0,0,0,0,0,0,1,0
"@hawk17037336","work toward providing global information on environmental humanitarian issues",0,0,0,0,0,0,0,0,0,0,1
"@jvanderhoop","mitwhoi graduate student marine mammalogist oceanographer",0,1,0,0,0,0,0,0,0,0,0
"@juliapgjones","conservation scientist commenting on environment biodiversity stories with a particular interest in madagascar",0,0,0,1,0,0,0,0,0,0,0
"@bpseudomallei","economics biology in other words conservative from the great state of texas currently in taxachusetts go figure",0,0,0,1,0,0,0,0,0,0,0
"@adrian_p_n","geographer critical geographies voyager political ecology assemblage socionatures belonging the commons zimbabwean",0,0,0,1,0,0,0,0,0,0,0
"@chriscmooney","energy environment writer at washingtonpost also tweeting at postgreen",0,0,0,0,0,0,1,0,0,0,0
"@jamesemcdonald","lecturer in environmental microbiology bangoruni all views are personal",1,0,0,0,0,0,0,0,0,0,0
"@gh648","researcher iisdnews enabling govs private sector entities to harness market forces for good finance risk governance resources standards indicators",0,0,0,0,0,0,1,0,0,0,0
"@ag_artigupta",NA,0,0,0,0,0,0,0,0,0,1,0
"@kelecable","grad student at university of minnesota history of science experimental evolution birds prairies author of kestrels cerevisiae histsci",0,1,0,0,0,0,0,0,0,0,0
"@happy_newyear15",NA,0,0,0,0,0,0,0,0,0,1,0
"@fishmdave",NA,0,0,0,0,0,0,0,0,0,1,0
"@kimkmoritz",NA,0,0,0,0,0,0,0,0,0,1,0
"@jonfrosch","set style to overwrought",0,0,0,0,0,0,0,0,0,0,1
"@drmoriartyy","assistant professorhku marine paleoecology macroecology biodiversity deepsea biology conservation paleobiology paleontology of ostracoda etc",0,0,0,1,0,0,0,0,0,0,0
"@geographicalmag","the magazine of the royal geographical society culture wildlife environment science travel exploration andof coursegeography",0,0,0,0,0,1,0,0,0,0,0
"@analauda","information specialist at institute for oncology radiology of serbia",0,0,0,0,0,1,0,0,0,0,0
"@emeraldseajess","marine ecologist research coordinator for howe sound research at the vancouver aquarium msc student at simon fraser university",0,1,0,0,0,0,0,0,0,0,0
"@ecowatchnz","marine environmental researcher",0,0,0,0,0,0,0,0,0,0,1
"@amycerini","i 3 stains",0,0,0,0,0,0,0,0,0,0,1
"@grovelab","recently independent virologist at uclslms using badass microscopes to study how viruses enter cells evade the immune system",0,1,0,0,0,0,0,0,0,0,0
"@drantonialaw","physical geographer with an interest in quaternary environments palaeolimnology occasional moraine embracer chablis chaser works at keele university",0,0,0,1,0,0,0,0,0,0,0
"@davidpsanders","computational physicist experimental mathematician julian julialang teacher parttime violinist",0,0,0,1,0,0,0,0,0,0,0
"@aliciaglassco","oceanloving pollution maven",0,0,0,0,0,0,0,0,0,0,1
"@aquafiles","media guy scientific diver marine critter geek tweets from above below the waves board member marineafloat shark dive program instructor ptdefiancezoo",0,0,1,0,0,0,0,0,0,0,0
"@fedhillbillies","baltimore americana",0,0,0,0,0,0,0,0,0,0,1
"@astburydiana",NA,0,0,0,0,0,0,0,0,0,1,0
