"Username","bio","faculty","student","mza","other.sci","outreach","sci.assoc","media","applied","politician","unknown","public"
"@georgiejhead","work for naturetrek recently graduated in zoology from the university of southampton interested in wildlife conservation travel",0,0,0,1,0,0,0,0,0,0,0
"@freezinghand","plays sitar piano beekeeper busker",0,0,0,0,0,0,0,0,0,0,1
"@daniel_kentnews","kent county news editor photographer writer of folksy columns soccer player waiting for an mls call up dog wrangler adventurer allaround good guy",0,0,0,0,0,0,1,0,0,0,0
"@aor_4","research liaison officer european commission representation in ireland opinions are my own retweet endorsement",0,0,0,0,0,0,0,0,0,0,1
"@c0dcommentaries","http tco lfphxidf just some youtube commentators trying to make it big on youtube we make commentaries tutorials for cod",0,0,0,0,0,0,0,0,0,0,1
"@barneycb1993","male",0,0,0,0,0,0,0,0,0,0,1
"@birdwocha","birds are brilliant nature is incredible surprising inspiring i love our wildlife care about it want to help it thrive laughings good too",0,0,0,0,0,0,0,0,0,0,1
"@elynedugeny","oceanography student at universit pierre et marie curie upmc paris vi sorbonne university passionate of marine life biodiversity",0,1,0,0,0,0,0,0,0,0,0
"@kharyp","first they ignore you then they laugh at you then they fight you then you win wi survivor outreach leader for everytown uniteblue",0,0,0,0,0,0,0,0,0,0,1
"@beacurious","curious vivacious biology masters of research student at macquarie university interested in plant physiology molecular biology microbiology",0,1,0,0,0,0,0,0,0,0,0
"@chazarovsky","serial entrepreneur data freak hare krishna",0,0,0,0,0,0,0,0,0,0,1
"@cathymbell","itinerant naturalist writer lover of parks wild lands i have a graduate degree in nature",0,0,0,1,0,0,1,0,0,0,0
"@eduroamlovesyou","all i want to do is give you internet love ",0,0,0,0,0,0,0,0,0,0,1
"@eshepw","environmental conservation community conservation sacred sites indigenous communities",0,0,0,0,0,0,0,0,0,0,1
"@elephantcount","the great elephant census is designed to provide an accurate count of the number of african elephants a paul g allen project rts are not endorsements",0,0,0,0,0,0,0,1,0,0,0
"@daveardell",NA,0,0,0,0,0,0,0,0,0,1,0
"@jonleff",NA,0,0,0,0,0,0,0,0,0,1,0
"@demersst","professeure fondements de lducation universit du qubec en outaouais",1,0,0,0,0,0,0,0,0,0,0
"@jonathangoran","i came i saw then i took a nap i get tired after i cum",0,0,0,0,0,0,0,0,0,0,1
"@chazz_findlay","4th year undergraduate marine biologist at the university of glasgow avid snowboarder scuba diver pizza consumer",0,0,0,1,0,0,0,0,0,0,0
"@hmserna","applied ecologist doing a phd i love doing scientific research reading writing fiction es en it pt",0,0,0,1,0,0,0,0,0,0,0
"@khunmat",NA,0,0,0,0,0,0,0,0,0,1,0
"@jr4science","ecologist captivated by evolution animal behaviour conservation reptiles amphibians are my jam eat sleep science lizardlab",0,0,0,1,0,0,0,0,0,0,0
"@gaeilgecroi","neuropsy major forever in college living in a galaxy far far away from home ",0,0,0,0,0,0,0,0,0,0,1
"@dk_dowling","evolutionary biologist at monash university australia",0,0,0,1,0,0,0,0,0,0,0
"@flambeau66",NA,0,0,0,0,0,0,0,0,0,1,0
"@_forwildlife","working to conserve willdlife their habitats game ranger jim is a conservationist earth fairy is a vegetarian working on specific projects for wildlife",0,0,0,0,0,0,0,0,0,0,1
"@dondi_tondro","author award winning journalist yoga massage therapist doula healthy foodie i can build a small house raise a girl child take over the world",0,0,0,0,0,0,1,0,0,0,0
"@guble","ecologist food lover fan of many things",0,0,0,1,0,0,0,0,0,0,0
"@cognitivsurplus","intelligent sustainable scientifically accurate gifts we make smart look good",0,0,0,0,0,0,0,0,0,0,1
"@ferragutmar","soy periodista trabajo en prensa esta cuenta es personal",0,0,0,0,0,0,1,0,0,0,0
"@emmaymal",NA,0,0,0,0,0,0,0,0,0,1,0
"@chrissy_houston","university of miami marine biology all things ocean alpha delta pi dancer life is awesome lets make the world awesome",0,0,0,1,0,0,0,0,0,0,0
"@_safeashouses_","members elliot anton lauren taylor andrew laughton thomas laughton bensen carter visit safeashousesca vote for us for searchlight this year link below",0,0,0,0,0,0,0,0,0,0,1
"@karapitman","i am a landscape ecologist wilderness adventurer",0,0,0,1,0,0,0,0,0,0,0
"@cbdawson","tweeting geoscience groundwater plain language science communication public science gov web best practices personal acct opinions are all mine",0,0,0,0,0,0,1,0,0,0,0
"@kaybeediamondz","dream chasertumblr addictsoul survivor i am echelon ",0,0,0,0,0,0,0,0,0,0,1
"@jcplantecology",NA,0,0,0,0,0,0,0,0,0,1,0
"@ardeaabe","scientist aspiring amateur naturalist birder gamer dabbler",0,0,0,1,0,0,0,0,0,0,0
"@craigbrookes_","aspiring ornithologist migration boffin ringer traveller hockey player analytical thinker currently study wildlife conservation at nottingham trent uni",0,1,0,0,0,0,0,0,0,0,0
"@chanandani","eventually all the dots will connect",0,0,0,0,0,0,0,0,0,0,1
"@dick_70","webmestre it addict aux mdias tl cin radio internet curieux tellement srieux ben a dpend",0,0,0,0,0,0,1,0,0,0,0
"@kamounlab","biologist at the sainsbury lab passionate about plant pathogens effectors genomics evolution loves travel food sports nomad huntergatherer",0,0,0,1,0,0,0,0,0,0,0
"@ghendi","law student at vanderbilt interested in environmental issues",0,1,0,0,0,0,0,0,0,0,0
"@hearstranchbeef","we produce freerange grassfed grassfinished beef on 150000 acres in central california",0,0,0,0,0,0,0,0,0,0,1
"@beccascards","if you are looking for unique cards gifts that will make someones day come visit my etsy shop i will try to post a new item everyday for my followers ",0,0,0,0,0,0,0,0,0,0,1
"@alisonsimmance","postgrad researcher uni southampton follow me ecosystemservices fisheries malawi aquaculture food security bkgd marine resource mgmt",0,0,0,0,0,0,0,0,0,0,1
"@kingswaypilates","pilates restorative exercise teacher learning development professional movement geek mom",0,0,0,0,1,0,0,0,0,0,0
"@c_e_gray","phd student at silwood park working on the effects of anthropogenic pressures on ecological networks",0,1,0,0,0,0,0,0,0,0,0
"@globalscp","convened by unep bringing together the sustainable consumption production scp community worldwide like us at https tco hs8qgm2fvv",0,0,0,0,0,0,1,0,0,0,0
"@jennifershaw86","scientist hippy animal lover using molecular tools to further understanding of human mediated impacts to the environment conservation ngs genetics",0,0,0,1,0,0,0,0,0,0,0
"@death_and_candy","chronic disease weasel zombie they them pronouns preferred",0,0,0,0,0,0,0,0,0,0,1
"@kimberlyannmac","maths teacher pathways coordinator using solo taxonomy design thinking growth mindset to inspire kids to take control of their learning",0,0,0,0,1,0,0,0,0,0,0
"@birds_central","birder naturalist wildlife guide zoology editor at the grip vocal advocate of no pet cats allowed outside",0,0,0,1,0,0,1,0,0,0,0
"@downwithnickk","having fun snowboarding sciencing up your twitter feed",0,0,0,0,0,0,0,0,0,0,1
"@gracemcnick","i quite like the sea all the cool things that live in it",0,0,0,0,0,0,0,0,0,0,1
"@blakehaskell","trying to elevate small talk to medium talk uw biology",0,0,0,1,0,0,0,0,0,0,0
"@charles5perrier",NA,0,0,0,0,0,0,0,0,0,1,0
"@aubrey_bales3","an eye for an eye will only make the whole world blind senior at collins",0,0,0,0,0,0,0,0,0,0,1
"@julie1974smith",NA,0,0,0,0,0,0,0,0,0,1,0
"@cheznadia","stratge numrique digital strategist mdias sociaux social media fluxus arts charge de cours uqam",0,0,0,0,0,0,0,0,0,0,1
"@insectsnsociety","we are two professors that study love bugs we tweet blog about insect science the role of insects in society at http tco 99iwapta",0,1,0,0,0,0,0,0,0,0,0
"@drtimdaley","director institute for sustainability solutions research plymuni new agendas in climate earth system sustainability research issrplymuni",0,0,0,1,0,0,0,0,0,0,0
"@albatros_mt","albatros marine technologies is a company that focuses its activity in research development innovate on oceanographic instrumentation",0,0,0,0,0,0,0,0,0,0,1
"@jranganathan","conservation biologist cofounder of scifund challenge a new approach to fund science break the ivory tower pomegranate enthusiast",0,0,0,1,0,0,0,1,0,0,0
"@emlerie","stop it",0,0,0,0,0,0,0,0,0,0,1
"@coralreefregen","chicagoarea students learning about the marine life history of la republica dominicana through digital media scientific immersion",0,1,0,0,0,0,0,0,0,0,0
"@eichhornlab","a scientist interested in natural materials biomimetics all views are personal",0,0,0,1,0,0,0,0,0,0,0
"@denniscardiff","author http tco bcrkhkxg3l blogger http tco c3gjbw6guu facebook http tco o8auf12xl4",0,0,0,0,0,0,1,0,0,0,0
"@kcheruvelil","im a landscape limnologist studentcentered prof at michigan state university",1,0,0,0,0,0,0,0,0,0,0
"@arodwh99","wharton grad into turnaround management entrepreneurship consulting usability doral wine cooking politics",0,0,0,0,0,0,0,0,0,0,1
"@alisouthsea","im a press officer an editor will probably tell you to use fewer instead of less cos thats the bit of grammar i know",0,0,0,0,0,0,1,0,0,0,0
"@kennydaleliles","my name is dale liles i am an avid duck hunter cofounder of g6 waterfowl chairman for ducks unlimited bama director of tennessee valley basketball as",0,0,0,0,0,0,0,0,0,0,1
"@clublightfx","clublightfx is a highly dynamic organisation selling innovative lighting solutions furniture for clubs bars cafes more",0,0,0,0,0,0,0,0,0,0,1
"@fopsom","researcher center for research technology hellas",0,0,0,0,0,1,0,0,0,0,0
"@clements_andrea",NA,0,0,0,0,0,0,0,0,0,1,0
"@gehennaharakiri","firstly im biologically female i like to pretend im a homosexual man online for fun my hobbies include drawing video games i enjoy netflix sleeping",0,0,0,0,0,0,0,0,0,0,1
"@k_orgill","phd student at university of sheffield looking at wetland restoration in the humberhead levels biodiversity ecosystem services landscapescale conservation",0,1,0,0,0,0,0,0,0,0,0
"@invasivenotes","ask me your questions sustainability ecosystems invasive species natural philosophy history politics current events explained",0,0,0,0,0,0,0,0,0,0,1
"@howardbutler","open source software developer pdal gdal mapserver libspatialindex others",0,0,0,0,0,0,0,0,0,0,1
"@carinaparaiso",NA,0,0,0,0,0,0,0,0,0,1,0
"@acuriousmeerkat","a science blog by covering evolution conservation sustainability medicine biotechnology news latest research in depth articles interviews",0,0,0,0,0,0,1,0,0,0,0
"@kelprmy","norwegian marine biologist phd environmental consultant sometimes a raving lunatic playing tuba on very special occasions",0,0,0,1,0,0,0,0,0,0,0
"@alison_bowden","ecologist lover of animals the arts kayaking sustainable vegn food i work for healthy rivers healthy communities natureorg",0,0,0,1,0,0,0,0,0,0,0
"@cartoon_neuron","the increasingly misnamed journal of cartoon neuroscience neuro microbes planets donuts plankton other science blog at http tco yy5c40jtdx",0,0,0,0,0,1,0,0,0,0,0
"@haiboshang",NA,0,0,0,0,0,0,0,0,0,1,0
"@gruizpacco",NA,0,0,0,0,0,0,0,0,0,1,0
"@jeffreymarkert","saving the biosphere one allele at a time ",0,0,0,0,0,0,0,0,0,0,1
"@emmagaffney_","the beatles my pooch are tied for numero uno university of waterloo biochemistry",0,0,0,0,0,0,0,0,0,0,1
"@action_earth","wildlife conservation animal rights blog https tco gjlmq6swjj",0,0,0,0,0,0,1,0,0,0,0
"@grahamfappleton","freelance writer lifelong birdwatcher bto volunteer formerly director of communications for bto",0,0,0,0,0,0,1,0,0,0,0
"@brianisaack","frontend developer grapic designer web designer ui ux strategist gamer blogger currently team lead at squad digital nairobi kenya",0,0,0,0,0,0,1,0,0,0,0
"@dontdodinosaurs","bioanthro gal chasing my masters while working museumofnature fueled by coffee obsessed with human bones but i just dont do dinosaurs all tweets my own",0,0,1,0,0,0,0,0,0,0,0
"@hannahstark86",NA,0,0,0,0,0,0,0,0,0,1,0
"@beebats","cro mammal expert bat specialist from state institute for nature protection views are my own",0,0,0,0,0,0,0,0,0,0,1
"@cinharenteaomar",NA,0,0,0,0,0,0,0,0,0,1,0
"@jessikathorn",NA,0,0,0,0,0,0,0,0,0,1,0
"@joely3282",NA,0,0,0,0,0,0,0,0,0,1,0
"@heidhorch","writer gypsy horse owner slave to the laundry pile feeder of men now fulltime college student yikes arted kidlit",0,1,0,0,0,0,0,0,0,0,0
"@k1nkyvicki",NA,0,0,0,0,0,0,0,0,0,1,0
"@cgrayhudson","marine philanthropy sciencepolicy frustrated diyer director lenfestocean",0,0,0,0,0,0,0,1,0,0,0
"@fiubrowardalum","the broward alumni chapter serves golden panthers living or working in the broward county area",0,0,0,0,0,0,0,0,0,0,1
"@jonhybravo2","jack of all trades master of none amature entomologist aging headbanger what seems like a professional student",0,1,0,0,0,0,0,0,0,0,0
"@jackcroxall","ya author science literature writer fiction fanatic",0,0,0,0,0,0,1,0,0,0,0
"@jonnyholt21","lancashireborn vet student studying in london at the royal veterinary college fullback winger for rvcfc blackburn rovers season ticket holder",0,1,0,0,0,0,0,0,0,0,0
"@jacksonrunte","move in nature",0,0,0,0,0,0,0,0,0,0,1
"@dwayne974us",NA,0,0,0,0,0,0,0,0,0,1,0
"@gabyingles","profe de ingles snow sports viajar sacar fotos de naturaleza cocinar viv y trabaje en usa tengo mi programa de radio de los beatles english teacher",0,0,0,0,1,0,0,0,0,0,0
"@alexlee2011","a silent man",0,0,0,0,0,0,0,0,0,0,1
"@javi_marlop","landscape ecologist working in conservation remote sensing modeling rstats python grassgis dopaexplorer",0,0,0,1,0,0,0,0,0,0,0
"@andyleider","supporting the next generation of purposeful leaders",0,0,0,0,0,0,0,0,0,0,1
"@eurotork","news info buzz about europe",0,0,0,0,0,0,1,0,0,0,0
"@kayfras0",NA,0,0,0,0,0,0,0,0,0,1,0
"@borders64",NA,0,0,0,0,0,0,0,0,0,1,0
"@gekz32",NA,0,0,0,0,0,0,0,0,0,1,0
"@einstien0000",NA,0,0,0,0,0,0,0,0,0,1,0
"@aims_ceo","john gunn is the ceo of the australian institute of marine science australias tropical marine research agency",0,0,0,0,0,1,0,0,0,0,0
"@cordymichelle","slightly nerdy fluffy animal science obsessed dance coach who lives for flip flop weather loves to laugh",0,0,0,0,0,0,0,0,0,0,1
"@bektashson","phd student",0,1,0,0,0,0,0,0,0,0,0
"@iverson_tracey","just a girl from liverpool uk that loves animals the environment i now live in canada hate our pm harper",0,0,0,0,0,0,0,0,0,0,1
"@katherineeer",NA,0,0,0,0,0,0,0,0,0,1,0
"@henrystackle1","henrys tackle shop 19 ballybough road dublin 3 tel 353 1 8555216 http tco wdocax7rz2 tackle fishing",0,0,0,0,0,0,0,0,0,0,1
"@emicorcoran","a marine ecologist fascinated with everything to do with oceans what we do to them with them in them also ecphotography",0,0,0,1,0,0,0,0,0,0,0
"@docdjedje","research wildlife biologist phd i tweet about ecology conservation birds views are my own",0,0,0,1,0,0,0,0,0,0,0
"@allanmargolin","allan husband dad editorial dir climate nexus climatehotnews i climate scientists frmr edf media dir abc political prod aomo rts endorse",0,0,0,0,0,0,1,1,0,0,0
"@breezymediausa","watch read play",0,0,0,0,0,0,0,0,0,0,1
"@jhortscib","publishing peerreviewed research on fruit perennial crops vegetables ornamentals in commercial amenity recreational horticulture",0,0,0,0,0,0,1,0,0,0,0
"@docaroe","a bug geek with many hats who knows the joys of rolling prairies dark chocolate",0,0,0,0,0,0,0,0,0,0,1
"@briggsyb","mostly football tea general witterings a bit of tree hugging see botanistbriggs for plant environment tropical botany travel etc",0,0,0,1,0,0,0,0,0,0,0
"@getswamped","robbie stephen keszey the swamp brothers official twitter",0,0,0,0,0,0,0,0,0,0,1
"@aferrari7","http tco yeurcaqgho",0,0,0,0,0,0,0,0,0,0,1
"@gabrielhemery","silvologist author photographer",0,0,0,1,0,0,1,0,0,0,0
"@erikalnewton","managing editor britishecolsoc for jappliedecology animalecology bookworm nature photography fan all views my own",0,0,0,0,0,0,1,0,0,0,0
"@illusions_uk","tweeting on energy environment science society",0,0,0,0,0,1,0,0,0,0,0
"@cherilynnpirtle","believer wife proud mommy school counselor love animals life",0,0,0,0,0,0,0,0,0,0,1
"@bwueringer","marine zoologist woking with sharks rays sawfish",0,0,0,1,0,0,0,0,0,0,0
"@imageschel","getty images photographer travel hd video cameraman stillsart work available at paradise arts providenciales innova arts mobile alabama fb chel beeson",0,0,0,0,0,0,1,0,0,0,0
"@180earth","plant grow harvest repeat",0,0,0,0,0,0,0,0,0,0,1
"@jp_odwyer","assistant professor school of integrative biology university of illinois interested in ecology biocomplexity",1,0,0,0,0,0,0,0,0,0,0
"@fishjournals","150 new article journal feeds filtered for fishy related papers chrome users install google rss subscription extension artbeckerechivard creator jglonder",0,0,0,0,0,1,0,0,0,0,0
"@fishin140","intent on fish recipes in 140 charactershelp required",0,0,0,0,0,0,0,0,0,0,1
"@bdassociationuk","we are a uk charity championing this highly sustainable organic approach to farming gardening inspired by rudolf steiner offering certification",0,0,0,0,0,0,0,1,0,0,0
"@aharhon","biologist",0,0,0,1,0,0,0,0,0,0,0
"@jacquelinelmaud","marine biologist nerc phd researcher zooplankton copepod population dynamics climate change plymouth marine lab queen mary university of london",0,0,0,1,0,0,0,0,0,0,0
"@crowhuck","nothing special",0,0,0,0,0,0,0,0,0,0,1
"@bingolittle1",NA,0,0,0,0,0,0,0,0,0,1,0
"@bkhstum","32 yearold student photographer musician artist champion of earth",0,1,0,0,0,0,0,0,0,0,0
"@hardy1733","cyclist for umn gophers iuuentum de borea sum",0,0,0,0,0,0,0,0,0,0,1
"@erolmaras","bo ve lzumsuz konuup yazan baz zalimleri tandka az dili olmayan hayvan dostlar sessiz tabiat ve fotograf daha ok seven fani dnya misafiri bir kul",0,0,0,0,0,0,1,0,0,0,0
"@buxley_hall",NA,0,0,0,0,0,0,0,0,0,1,0
"@jhenryski","stayingstrong physicaltherapy mother southtexaslife",0,0,0,0,0,0,0,0,0,0,1
"@hdiploid","science data education health shiny things happydiploidgmailcom",0,0,0,0,0,0,0,0,0,0,1
"@justherluck_"," web developer aquarian funny animal lover love making friends technophile art music photography nature chocolates talkative charity",0,0,0,0,0,0,0,1,0,0,0
"@amfitzpatrick01",NA,0,0,0,0,0,0,0,0,0,1,0
"@dirtybeachtweet","brightonbased artists mccurdy hanksy are dirty beach artists working with marine plastic waste",0,0,0,0,0,0,0,0,0,0,1
"@acmoffitt",NA,0,0,0,0,0,0,0,0,0,1,0
"@antropoteuthis","bs marine scientist prospective phd student gelatinous zooplankton lover scuba addict",0,1,0,0,0,0,0,0,0,0,0
"@blonderose01",NA,0,0,0,0,0,0,0,0,0,1,0
"@heatherj750","love animals bugs classic rock criminal minds ghost hunters the three stooges please dont shop adopt save a pets life",0,0,0,0,0,0,0,0,0,0,1
"@alicetoll","biostatistics phd student at vanderbilt striving to improve programing skills mostly rstats i also love rabbits",0,1,0,0,0,0,0,0,0,0,0
"@cbrnaturemap","follow us for the latest sightings of rare endangered plants many of the treasures that exist in around canberras nature parks",0,0,0,0,0,0,0,0,0,0,1
"@abneuheimer",NA,0,0,0,0,0,0,0,0,0,1,0
"@carolostergren",NA,0,0,0,0,0,0,0,0,0,1,0
"@esylviarchitect","architect dogowner new age spiritualist capricorn",0,0,0,0,0,0,0,0,0,0,1
"@hykuviboler","im a fly fisherman who likes to catch wild fish from wild places",0,0,0,0,0,0,0,0,0,0,1
"@fionabradleyx","director of the fruitmarket gallery in edinburgh all tweets personal see also fruitmarket",0,0,0,0,0,0,0,0,0,0,1
"@joaomgrod",NA,0,0,0,0,0,0,0,0,0,1,0
"@elbab772"," coldrmohamed elghanam refused to spy for the swisskidnapped 8 years in swiss gitmofree him",0,0,0,0,0,0,0,0,0,0,1
"@doris_egan","i write for love i write for money i try to do them both at the same time",0,0,0,0,0,0,0,0,0,0,1
"@jumpingenejesse","msc student in pathology laboratory medicine fitness junkie sports enthusiast determined to become better everyday",0,1,0,0,0,0,0,0,0,0,0
"@arthroleptis","ecologist environmentalist birder kiwi tracker diver occasional wildlife photographer views my own",0,0,0,1,0,0,1,0,0,0,0
"@graham_raby","australian endeavor postdoctoral research fellow aimsgovau fish biology conservation also into politics toronto maple leafs liverpool fc",0,1,0,0,0,0,0,0,0,0,0
"@ahamdi5","a cheme phd candidate interested in macromolecular physics mathematical theoretical biology currently studying novel polymer bacteria composites",0,1,0,0,0,0,0,0,0,0,0
"@hoofcarejournal","hoofcare lameness journal the hoof blog goto farrier veterinary info sources on horse hooves equine laminitis follow editor fran jurga franjurga too",0,0,0,0,0,1,0,0,0,0,0
"@amy_molo","be the change you want to see",0,0,0,0,0,0,0,0,0,0,1
"@ashleyhasna","social media lover writer pop culture princess also love books movies ocean food if theres something to trip on ill find it",0,0,0,0,0,0,1,0,0,0,0
"@colmerecology","director associate ecologist at colmer ecology we provide ecological services to the private public sector mailcolmerecologycouk 01392 758325",0,0,0,1,0,0,0,0,0,0,0
"@alter_edenism","gillian leitch elemental designer native plant lover beekeeper",0,0,0,0,0,0,0,0,0,0,1
"@alexholdgate","amateur marine scientist occasional philosopher former allstate american athlete",0,0,0,1,0,0,0,0,0,0,0
"@aprilsunny","make the world a better place if you can by better i mean happier healthier more peaceful",0,0,0,0,0,0,0,0,0,0,1
"@asmkelly","manage faculty development programs for asmicrobiology i sci educators microbiology swankyshoes nasasocial team24 nyg tweetsmine only",1,0,0,0,0,0,0,0,0,0,0
"@earlconf","effective applications of the r language london 14th 16th september 2015 boston 2nd 4th november 2015",0,0,0,0,0,0,0,0,0,0,1
"@haertcore","computer engineer atheist agnostic handsome",0,0,0,0,0,0,0,0,0,0,1
"@helenbayram","postdoctoral researcher at uppsala university ejaculate proteomics obsessive dog mum massive fan of cake",0,1,0,0,0,0,0,0,0,0,0
"@drnataliehicks","zimbabweborn marine scientist working in scotland investigating climate change effects on marine ecosystems",0,0,0,1,0,0,0,0,0,0,0
"@gchandler93","oxford mscbiodiversity how inappropriate to call this planet earth when it is quite clearly ocean conservationist wanderlust artist pancakeaholic",0,0,0,0,0,0,0,0,0,0,1
"@alinascheutzow",NA,0,0,0,0,0,0,0,0,0,1,0
"@jennihultman",NA,0,0,0,0,0,0,0,0,0,1,0
"@gravelpits","postdoctoral researcher for inserm university of strasbourg france ibmc cnrs rponse immunitaire et dveloppement chez les insectes",0,1,0,0,0,0,0,0,0,0,0
"@fdinosaurios","la fundacin dinosaurios cyl tiene entre sus objetivos la gestin difusin y promocin del museo de dinosaurios de salas de los infantes burgos espaa",0,0,1,0,0,0,0,0,0,0,0
"@jtelsnig",NA,0,0,0,0,0,0,0,0,0,1,0
"@colliersoph","ak basking shark snorkeling coordinator divemaster lover of the cornish coastline breakfast food",0,0,0,0,0,0,0,0,0,0,1
"@dr_dbw","random interesting stuff science technology art colloid surface chemistry scientist in spare time",0,0,0,1,0,0,0,0,0,0,0
"@jimmy_caeser",NA,0,0,0,0,0,0,0,0,0,1,0
"@cervelle","postdoc brain scientist of behavioural systems persuasion memory aging mbi devotee of martha graham also canadian",0,1,0,0,0,0,0,0,0,0,0
"@katebranley","geologist passions include family friends sedimentology hiking being with rocks in their natural habitat good books wine beer",0,0,0,1,0,0,0,0,0,0,0
"@davidboles","mfa columbia teach gccuny nyuniversity fordhamnotes njit rutgersu write pearson netnebraska palgraveusa bnbuzz theschooner mheducation cengageptr",0,0,0,0,1,0,0,0,0,0,0
"@iphone4_32gb_94","we offer the minimun price all over the world you can purchase products with factory price saving 300 http tco jsxieq7eyc",0,0,0,0,0,0,0,0,0,0,1
"@agrinsted","im a climate scientist working at the centre for ice climate niels bohr institute i work with sea level rise extreme events cryosphere ice cores",0,0,0,1,0,0,0,0,0,0,0
"@garystuartkay",NA,0,0,0,0,0,0,0,0,0,1,0
"@jeepfungame",NA,0,0,0,0,0,0,0,0,0,1,0
"@astroalanod","i looovee sciencegame of thrones is my life got i have no special talentsim only passionately curious alberteinstein",0,0,0,0,0,0,0,0,0,0,1
"@fkbarker",NA,0,0,0,0,0,0,0,0,0,1,0
"@juliafilippone",NA,0,0,0,0,0,0,0,0,0,1,0
"@bradwheller","i am the owner director of wheller global enterprises ltd wberad http tco 6l3ctukkem manage http tco vbtdlelyvp",0,0,0,0,0,0,0,0,0,0,1
"@chiroxiphia81","conservation birds scifi fantasy",0,0,0,0,0,0,0,0,0,0,1
"@k_aelle","mostly curious international msc student in marine biodiversity conservation",0,1,0,0,0,0,0,0,0,0,0
"@ginasalibaa","the expert in anything was once a beginner teacher educational advisor eassessment enthusiast lifelong learner insomniac views are my own",0,0,0,0,1,0,0,0,0,0,0
"@doc_becca","literally an elephants bum",0,0,0,0,0,0,0,0,0,0,1
"@hottopicnz","monitoring climate change global warming science policy politics in nz the world",0,0,0,0,0,0,0,1,0,0,0
"@gwennoda","always busy with something",0,0,0,0,0,0,0,0,0,0,1
"@jukkaaroviita","aquatic ecologist sykeinfo with a mind twisted on how to assess freshwater quality using good science",0,0,0,1,0,0,0,0,0,0,0
"@kieraxxvi"," when you want to succeed as bad as you wanna breathe then youll be successful",0,0,0,0,0,0,0,0,0,0,1
"@hollie_berry1","zoologist msc in wildlife management conservation unireading kent wildlife trust trainee warden extinction is forever",0,0,0,1,0,0,0,1,0,0,0
"@k_loncke","laboratory assistant student mountaineer runner main interest neuroscience tendency towards constructively critical grumble but latently optimistic",0,1,0,0,0,0,0,0,0,0,0
"@djpmoore","assoc professor ecosystem scientist tucson az phenology sustainability disturbance ecosystems modelling studying the carbon cycle",1,0,0,0,0,0,0,0,0,0,0
"@adamjtaylor","englishman abroad postdoc at uwmoles shoots at cells tissues with an ion gun or twop",0,1,0,0,0,0,0,0,0,0,0
"@fraughtwpurpose",NA,0,0,0,0,0,0,0,0,0,1,0
"@crc_chemistry","follow chemistry books for news on new publications special offers here from crc press",0,0,0,0,0,0,1,0,0,0,0
